{"candidate_files":[{"after_sha256":"2222222222222222222222222222222222222222222222222222222222222222","before_sha256":null,"change":"add","path":"README.md"},{"after_sha256":"3333333333333333333333333333333333333333333333333333333333333333","before_sha256":null,"change":"add","path":"assets/readme-showcase/en/desktop.svg"},{"after_sha256":"4444444444444444444444444444444444444444444444444444444444444444","before_sha256":null,"change":"add","path":"assets/readme-showcase/en/mobile.svg"}],"compiled":{"fingerprint":"8888888888888888888888888888888888888888888888888888888888888888","inventory":{"path":"compiled/inventory.json","sha256":"7777777777777777777777777777777777777777777777777777777777777777"}},"evaluation":{"bundle_sha256":"5555555555555555555555555555555555555555555555555555555555555555","report_sha256":"6666666666666666666666666666666666666666666666666666666666666666","status":"pass"},"exclusions":[".omo/**","evaluation-only/**","node_modules/**","previews/**","run-artifacts/**"],"fingerprint":"ab8d34043bd035b2f61e6a5017874534c7c21039a9d5280f11b8a14f4f7b7961","metadata":{"commit_message":"docs(readme): refresh project showcase","pull_request_body":"## Summary\\n\\n- Refresh compiled visual artifacts\\n\\n## Verification\\n\\n- Deterministic hard gates: pass\\n","pull_request_title":"docs: refresh README showcase"},"mode":"readme","schema_version":2,"semantic_sources":[],"status":"ready","target":{"base_sha":"1111111111111111111111111111111111111111","branch":"readme-showcase/0123456789ab","repository":"Acfufu/readme-showcase"}}
